<?xml version="1.0" encoding="utf-8"?>
<xs:schema attributeFormDefault="unqualified" elementFormDefault="qualified" xmlns:xs="http://www.w3.org/2001/XMLSchema"
           targetNamespace="lcc" xmlns="lcc" xmlns:k="lcc">
  <xs:element name="lccSchema">
    <xs:complexType>
      <xs:sequence>
        <xs:element name="metadata">
          <xs:complexType>
            <xs:sequence>
              <xs:element type="xs:string" name="name"/>
              <xs:element type="xs:string" name="description"/>
            </xs:sequence>
          </xs:complexType>
        </xs:element>
        <xs:element name="coefficients">
          <xs:annotation>
            <xs:documentation>
              * The "Coefficients" node contains coefficients to be assigned to values.
              *
              * id - text, unique identifier
              * name - text, name describing coefficient
              * fieldName - text, name of field to be created for output
            </xs:documentation>
          </xs:annotation>
          <xs:complexType>
            <xs:sequence>
              <xs:element name="coefficient" maxOccurs="unbounded" minOccurs="0">
                <xs:complexType>
                      <xs:attribute name="Id" use="required">
                        <xs:simpleType>
                          <xs:restriction base="xs:string">
                            <xs:enumeration value="NITROGEN"/>
                            <xs:enumeration value="PHOSPHORUS"/>
                            <xs:enumeration value="IMPERVIOUS"/>
                          </xs:restriction>
                        </xs:simpleType>
                      </xs:attribute>
                      <xs:attribute type="xs:string" name="Name" use="required"/>
                      <xs:attribute name="apMethod" use="required">
                        <xs:simpleType>
                          <xs:restriction base="xs:string">
                            <xs:enumeration value="A"/>
                            <xs:enumeration value="P"/>
                          </xs:restriction>
                        </xs:simpleType>
                      </xs:attribute>
                      <xs:attribute name="fieldName" use="required">
                        <xs:simpleType>
                          <xs:restriction base="xs:string">
                            <xs:minLength value="1"/>
                          </xs:restriction>
                        </xs:simpleType>
                      </xs:attribute>
                </xs:complexType>
              </xs:element>
            </xs:sequence>
          </xs:complexType>
        </xs:element>
        <xs:element name="values">
          <xs:annotation>
            <xs:documentation>
              * The "values" node defines the full set of values that can exist in a landcover raster
              * The "excluded" attribute is used to exclude values from the total, excluded=false is the default
              * Actual excluded values are always treated as excluded=true, cannot be used in classes, and should not be listed here.
            </xs:documentation>
          </xs:annotation>
          <xs:complexType>
            <xs:sequence>
              <xs:element name="value" maxOccurs="unbounded" minOccurs="0">
                <xs:complexType>
                  <xs:sequence>
                    <xs:element name="coefficient" maxOccurs="unbounded" minOccurs="0">
                      <xs:complexType>
                        <xs:simpleContent>
                          <xs:extension base="xs:string">
                            <xs:attribute name="Id" use="required"/>
                            <xs:attribute type="xs:decimal" name="value" use="required"/>
                          </xs:extension>
                        </xs:simpleContent>
                      </xs:complexType>
                    </xs:element>
                  </xs:sequence>
                  <xs:attribute type="xs:int" name="Id" use="required"/>
                  <xs:attribute type="xs:string" name="Name" use="optional"/>
                  <xs:attribute type="xs:boolean" name="excluded" use="optional"/>
                </xs:complexType>
                <xs:unique name="uniqueCoefficient">
                  <xs:selector xpath="coefficient"/>
                  <xs:field xpath="@Id"/>
                </xs:unique>
              </xs:element>
            </xs:sequence>
          </xs:complexType>
        </xs:element>
        <xs:element name="classes">
          <xs:annotation>
            <xs:documentation>
              * The "classes" node contains values grouped into classes.
              * A class can contain either values or classes but not both types
              * Values contain only an id which refers to a value in values node.
              * The id attribute is used for the root of the field name in the output(for example %forest would be P + for = Pfor)
              * Two classes with the same id are not allowed.
              * Special class attributes:
              - filter: a string of tool shortnames separated by a ";". If a shortname is provided, that class
              will not appear in the "Report metrics for these classes" section of that particular tool's gui dialog.
              Possible shortnames are: lcp, rlcp, lcosp, splcp, and caeam
              - xxxxField:  if present, it overides the default output field name with the supplied string value. "xxxx" refers
              to a tool's shortname. Possible shortnames are: lcp, rlcp, lcosp, splcp, and caeam
              Example, if lcpField="NINDEX" for the "nat" class, the default output, "pNat" will be overridden with "NINDEX"
            </xs:documentation>
          </xs:annotation>
          <xs:complexType>
            <xs:sequence>
              <xs:element name="class" maxOccurs="unbounded" minOccurs="1" type="classType"/>
            </xs:sequence>
          </xs:complexType>
        </xs:element>
      </xs:sequence>
    </xs:complexType>
    <!--<xs:key name="coefficientKey">
      <xs:selector xpath="k:coefficients/k:coefficient"/>
      <xs:field xpath="@Id"/>
    </xs:key>
    <xs:keyref name="coefficientKeyRef" refer="k:coefficientKey">
      <xs:selector xpath="k:values/k:value/k:coefficient"/>
      <xs:field xpath="@Id"/>
    </xs:keyref>-->
  </xs:element>
  <xs:complexType name="classType">
    <xs:sequence>
      <xs:choice minOccurs="1" maxOccurs="1">
        <xs:element name="class" maxOccurs="unbounded" minOccurs="0" type="classType"/>
        <xs:element name="value" maxOccurs="unbounded" minOccurs="0">
            <xs:complexType>
              <xs:simpleContent>
                <xs:extension base="xs:string">
                  <xs:attribute type="xs:int" name="Id" use="required"/>
                </xs:extension>
              </xs:simpleContent>
            </xs:complexType>
          </xs:element>
      </xs:choice>
    </xs:sequence>
    <xs:attribute type="xs:string" name="Id" use="required"/>
    <xs:attribute type="xs:string" name="Name" use="optional"/>
    <xs:attribute type="xs:string" name="lcpField" use="optional"/>
    <xs:attribute type="xs:string" name="rlcpField" use="optional"/>
    <xs:attribute type="xs:string" name="lcospField" use="optional"/>
    <xs:attribute type="xs:string" name="splcpField" use="optional"/>
    <xs:attribute type="xs:string" name="caeamField" use="optional"/>
    <xs:attribute type="xs:string" name="filter" use="optional"/>
  </xs:complexType>
</xs:schema>

